{
  "$schema": "../_schema.json",
  "format": "xlsx",
  "element": "sheet",
  "operations": {
    "add": true,
    "set": true,
    "get": true,
    "query": true,
    "remove": true
  },
  "paths": {
    "stable":     ["/<sheetName>"],
    "positional": ["/Sheet1", "/Sheet2"]
  },
  "note": "Add accepts name, position, autoFilter, tabColor, and hidden — these forward to the same code paths Set uses, preserving Add/Set symmetry. `freeze` remains Set-only.",
  "properties": {
    "name": {
      "type": "string",
      "description": "sheet tab name. Returned path is /<name>; readback goes through DocumentNode.Path / .Preview rather than Format[].",
      "add": true, "set": true, "get": true,
      "examples": ["--prop name=Summary"],
      "enforcement": "report"
    },
    "autoFilter": {
      "type": "string",
      "description": "range to apply AutoFilter on (e.g. A1:D10). `true` enables on used range.",
      "aliases": ["autofilter"],
      "add": true, "set": true, "get": true,
      "examples": ["--prop autoFilter=A1:D10"],
      "readback": "range string as stored, or boolean true",
      "enforcement": "report"
    },
    "tabColor": {
      "type": "color",
      "description": "sheet tab color.",
      "add": true, "set": true, "get": true,
      "examples": ["--prop tabColor=4472C4"],
      "readback": "#RRGGBB uppercase",
      "enforcement": "report"
    },
    "hidden": {
      "type": "bool",
      "description": "hide the sheet at creation or after the fact.",
      "add": true, "set": true, "get": true,
      "examples": ["--prop hidden=true"],
      "enforcement": "report"
    },
    "freeze": {
      "type": "string",
      "description": "freeze panes anchor (cell ref). A2 freezes row 1; B1 freezes column A; B2 freezes row 1 + column A. `none` / `false` / empty removes the freeze. Set-only on existing sheets.",
      "add": false, "set": true, "get": true,
      "examples": ["--prop freeze=A2", "--prop freeze=B2", "--prop freeze=none"],
      "readback": "top-left cell ref of frozen pane (e.g. A2); absent when no freeze",
      "enforcement": "report"
    },
    "direction": {
      "type": "enum",
      "values": ["rtl", "ltr"],
      "description": "RTL sheet layout (Arabic / Hebrew) — column A renders on the right, column scroll direction inverts. Maps to <sheetView rightToLeft=...>. Canonical key matches Word/PPT.",
      "aliases": ["rtl", "rightToLeft", "righttoleft", "sheet.direction"],
      "add": false, "set": true, "get": true,
      "examples": ["--prop direction=rtl", "--prop rightToLeft=true"],
      "readback": "rtl when set; absent when default (ltr)",
      "enforcement": "report"
    },
    "zoom": {
      "type": "number",
      "description": "sheetView zoom percentage (10-400). Emitted only when non-default (≠100).",
      "add": false, "set": false, "get": true,
      "readback": "zoom percentage 10-400",
      "enforcement": "report"
    },
    "gridlines": {
      "type": "bool",
      "description": "sheetView gridline visibility. Emitted only when hidden (false); default-on is omitted (CONSISTENCY(default-omission)).",
      "add": false, "set": false, "get": true,
      "readback": "true | false",
      "enforcement": "report"
    },
    "headings": {
      "type": "bool",
      "description": "row/column header visibility. Emitted only when hidden (false); default-on is omitted (CONSISTENCY(default-omission)).",
      "add": false, "set": false, "get": true,
      "readback": "row/column headings visible",
      "enforcement": "report"
    },
    "visibility": {
      "type": "enum",
      "values": ["hidden", "veryHidden"],
      "description": "workbook-level sheet state when not visible. Emitted alongside hidden=true; absent for default-visible sheets.",
      "add": false, "set": false, "get": true,
      "readback": "if hidden",
      "enforcement": "report"
    },
    "protect": {
      "type": "bool",
      "description": "sheet protection state (read from <sheetProtection sheet=true>). Emitted only when protection is enabled.",
      "add": false, "set": false, "get": true,
      "readback": "true if sheet protection enabled",
      "enforcement": "report"
    },
    "orientation": {
      "type": "string",
      "description": "PageSetup orientation (portrait | landscape). Emitted only when set on the sheet.",
      "add": false, "set": false, "get": true,
      "readback": "page orientation (portrait|landscape)",
      "enforcement": "report"
    },
    "paperSize": {
      "type": "number",
      "description": "PageSetup paper-size code (OOXML enumeration; e.g. 1=Letter, 9=A4).",
      "add": false, "set": false, "get": true,
      "readback": "OOXML paper size code",
      "enforcement": "report"
    },
    "fitToPage": {
      "type": "string",
      "description": "PageSetup fit-to-page width x height (e.g. '1x1' = fit to one page).",
      "add": false, "set": false, "get": true,
      "readback": "WxH fit-to-page settings",
      "enforcement": "report"
    },
    "printArea": {
      "type": "string",
      "description": "defined-name _xlnm.Print_Area for this sheet, with the leading 'SheetName!' prefix stripped so the value round-trips as an A1 range.",
      "add": false, "set": false, "get": true,
      "readback": "A1 range string",
      "enforcement": "report"
    },
    "margin.top": {
      "type": "string",
      "description": "PageMargins top margin in inches (e.g. '0.75in').",
      "add": false, "set": false, "get": true,
      "readback": "margin in inches",
      "enforcement": "report"
    },
    "margin.bottom": {
      "type": "string",
      "description": "PageMargins bottom margin in inches.",
      "add": false, "set": false, "get": true,
      "readback": "margin in inches",
      "enforcement": "report"
    },
    "margin.left": {
      "type": "string",
      "description": "PageMargins left margin in inches.",
      "add": false, "set": false, "get": true,
      "readback": "margin in inches",
      "enforcement": "report"
    },
    "margin.right": {
      "type": "string",
      "description": "PageMargins right margin in inches.",
      "add": false, "set": false, "get": true,
      "readback": "margin in inches",
      "enforcement": "report"
    }
  },
  "children": [
    { "element": "cell",  "pathSegment": "<A1Ref>", "cardinality": "0..n" },
    { "element": "chart", "pathSegment": "chart",   "cardinality": "0..n" }
  ]
}
